Year,Car Name,Mileage (kms),Fuel Type,Transmission,Price (Lakh),Location
2019,Honda City i-VTEC VX,"29,000",Petrol,Manual,7.50,"Salt Lake City, Kolkata"
2020,BMW 5 Series 520d Luxury Line,"9,800",Diesel,Automatic,39.95,"Ballygunge Rs, Kolkata"
2014,Maruti Wagon R Stingray VXI,"56,557",Petrol,Manual,2.65,"Narendrapur, Kolkata"
2016,Maruti S Cross DDiS 200 Alpha,"57,455",Diesel,Manual,4.97,"Salt Lake City, Kolkata"
2020,Maruti Celerio ZXI,"9,559",Petrol,Manual,4.32,"Kankurgachi, Kolkata"
2018,Hyundai i20 Active 1.2 S,"27,000",Petrol,Manual,4.85,"Khardah, Kolkata"
2023,Hyundai Grand i10 Nios Asta,"12,000",Petrol,Manual,6.49,"Kasba, Kolkata"
2016,Honda Jazz VX,"40,135",Petrol,Manual,4.12,"Kankurgachi, Kolkata"
2014,Maruti Swift Dzire VXI,"36,123",Petrol,Manual,3.01,"Kolkatta Gpo, Kolkata"
2019,Jeep Compass 2.0 Limited Plus BSIV,"23,000",Diesel,Manual,12.50,"Salt Lake City, Kolkata"
2023,Hyundai Verna SX Turbo DCT,"12,609",Petrol,Automatic,13.75,"Vaishya Sabha, Kolkata"
2019,Maruti Baleno 1.2 Zeta,"21,000",Petrol,Manual,5.75,"Ballygunge, Kolkata"
2017,Hyundai Tucson 2.0 e-VGT 2WD AT GLS,"68,700",Diesel,Automatic,9.75,"Ballygunge Rs, Kolkata"
2022,Hyundai i20 Asta BSVI,"7,900",Petrol,Manual,7.90,"Kasba, Kolkata"
2016,Hyundai Creta 1.6 VTVT SX Plus,"52,126",Petrol,Manual,5.60,"Salt Lake City, Kolkata"
2022,Maruti XL6 Alpha,"8,258",Petrol,Manual,10.47,"Salt Lake City, Kolkata"
2015,Volkswagen Vento 1.5 TDI Highline,"53,357",Diesel,Manual,2.75,"Alipore, Kolkata"
2011,Nissan Micra Diesel XV,"58,695",Diesel,Manual,1.70,"Khardah, Kolkata"
2018,Honda City i-VTEC CVT ZX,"51,513",Petrol,Automatic,6.70,"University, Kolkata"
2018,Hyundai Xcent 1.2 CRDi SX,"49,000",Diesel,Manual,3.99,"Ballygunge, Kolkata"
2022,Maruti Ertiga ZXI,"43,000",Petrol,Manual,9.25,"Jadavpur University, Kolkata"
2018,Hyundai Creta 1.6 SX Option Diesel,"80,000",Diesel,Manual,7.35,"Ballygunge, Kolkata"
2018,Hyundai Creta 1.6 VTVT SX Plus,"30,300",Petrol,Manual,7.50,"Elliot Road, Kolkata"
2016,Maruti Swift Dzire LDI,"52,000",Diesel,Manual,4.22,"Kasba, Kolkata"
2016,Hyundai Grand i10 Sportz,"75,938",Petrol,Manual,3.07,"University, Kolkata"
2020,Mahindra XUV300 W8 BSVI,"67,000",Petrol,Manual,7.65,"Council House Street, Kolkata"
2015,Maruti Wagon R VXI BS IV,"47,834",Petrol,Manual,2.54,"Kolkatta Gpo, Kolkata"
2021,Mahindra Thar LX 4WD Hard Top AT BSVI,"21,833",Petrol,Automatic,13.50,"Vaishya Sabha, Kolkata"
2013,Maruti Wagon R VXI BS IV,"60,714",Petrol,Manual,2.23,"Kolkatta Gpo, Kolkata"
2019,Maruti Wagon R VXI 1.2 BSIV,"81,807",Petrol,Manual,3.08,"Kolkatta Gpo, Kolkata"
2017,Hyundai Creta 1.4 CRDi S Plus,"85,000",Diesel,Manual,5.50,"Ballygunge, Kolkata"
2013,Maruti Swift Dzire ZXI,"89,278",Petrol,Manual,2.85,"Khardah, Kolkata"
2023,Mahindra Scorpio S 11 BSVI,"25,614",Diesel,Manual,16.90,"Salt Lake City, Kolkata"
2020,Mahindra Thar LX Hard Top Diesel,"50,000",Diesel,Manual,11.75,"Parnasree Pally, Kolkata"
2020,Renault Triber RXZ BSIV,"18,000",Petrol,Manual,5.25,"Barisha, Kolkata"
2019,Maruti Wagon R AMT VXI,"29,000",Petrol,Automatic,4.88,"Park Street Area, Kolkata"
2021,Maruti Ciaz Zeta AT BSVI,"39,000",Petrol,Automatic,6.49,"Kalikapur, Kolkata"
2019,Mahindra TUV 300 T10,"32,000",Diesel,Manual,5.75,"Airport Po, Kolkata"
2017,Ford Figo 1.2P Ambiente MT,"19,000",Petrol,Manual,3.45,"Kasba, Kolkata"
2014,Maruti Alto K10 2010-2014 VXI,"26,000",Petrol,Manual,1.85,"Barisha, Kolkata"
2022,Mahindra Thar LX 4WD Hard Top BSVI,"16,500",Petrol,Manual,12.99,"Park Street Area, Kolkata"
2020,Mahindra XUV300 W6 BSVI,"54,000",Petrol,Manual,5.99,"Kalikapur, Kolkata"
2014,Mercedes-Benz GLA Class 200 CDI,"30,000",Diesel,Automatic,15,"Vaishya Sabha, Kolkata"
2021,Ford Ecosport Signature Edition Diesel BSIV,"18,000",Diesel,Manual,9,"Jadavpur University, Kolkata"
2022,Hyundai i20 N-Line N8 DCT Dual Tone BSVI,"17,390",Petrol,Automatic,9.50,"Vaishya Sabha, Kolkata"
2017,Mahindra Thar CRDe,"83,000",Diesel,Manual,5.50,"Bengali Market, Kolkata"
2015,Maruti Swift Dzire VXI,"96,474",Petrol,Manual,3.32,"Kankurgachi, Kolkata"
2015,Hyundai Grand i10 Sportz,"78,200",Petrol,Manual,2.76,"University, Kolkata"
2012,BMW X1 sDrive20d,"53,000",Diesel,Automatic,4.90,"Kankurgachi, Kolkata"
2017,Mercedes-Benz S-Class S 350 d,"35,000",Diesel,Automatic,44.95,"Salt Lake City, Kolkata"
2019,Maruti Baleno Sigma,"62,924",Petrol,Manual,4.80,"Kolkatta Gpo, Kolkata"
2015,Hyundai Creta 1.6 VTVT S,"45,000",Petrol,Manual,5.45,"Kalikapur, Kolkata"
2016,Maruti Ciaz AT ZXi Plus,"35,000",Petrol,Automatic,4.25,"Salt Lake City, Kolkata"
2019,Volkswagen Ameo 1.0 MPI Comfortline,"34,713",Petrol,Manual,4.32,"Kolkatta GPO, Kolkata"
2016,Toyota Corolla Altis VL AT,"50,000",Petrol,Automatic,5.45,"Kalighat, Kolkata"
2023,Hyundai i20 Asta,"8,500",Petrol,Manual,7.99,"Park Street Area, Kolkata"
2017,Hyundai Creta 1.4 E Plus,"1,40,000",Diesel,Manual,5.25,"Ballygunge, Kolkata"
2018,Maruti Vitara Brezza VDi,"31,711",Diesel,Manual,6.50,"Beleghata, Kolkata"
2022,Mahindra Scorpio N Z8 BSVI,"19,000",Petrol,Manual,17.49,"Kalikapur, Kolkata"
2019,Maruti Swift Dzire ZXI Plus,"28,000",Petrol,Manual,6,"Parnasree Pally, Kolkata"
2020,Maruti Wagon R VXI 1.2,"43,000",Petrol,Manual,4.85,"Barisha, Kolkata"
2018,Jeep Compass 2.0 Limited,"60,000",Diesel,Manual,8.35,"Parnasree Pally, Kolkata"
2022,Hyundai i20 Asta Turbo DCT,"17,000",Petrol,Automatic,9.49,"Kalikapur, Kolkata"
2023,Maruti Swift ZXI BSVI,"22,000",Petrol,Manual,6.45,"Ballygunge, Kolkata"
2013,BMW 3 Series 320d Sport Line,"49,000",Diesel,Automatic,8.50,"Ballygunge, Kolkata"
2020,Hyundai Grand i10 1.2 Kappa Asta,"15,730",Petrol,Manual,5.49,"Kankurgachi, Kolkata"
2018,Honda Jazz V CVT,"44,000",Petrol,Automatic,4.65,"Kalighat, Kolkata"
2017,Renault Duster 110PS Diesel RxZ AMT,"66,000",Diesel,Automatic,5.45,"Kasba, Kolkata"
2023,Mahindra Scorpio S 11,"25,614",Diesel,Manual,16.90,"Salt Lake City, Kolkata"
2019,Maruti Baleno Zeta,"21,000",Petrol,Manual,5.75,"Ballygunge, Kolkata"
2014,Mini Cooper D High,"30,000",Diesel,Automatic,11,"Writers Building S.o, Kolkata"
2016,Hyundai Grand i10 Asta,"59,027",Petrol,Manual,3.59,"University, Kolkata"
2014,Datsun GO A,"37,009",Petrol,Manual,1.71,"Garia Bt, Kolkata"
2019,Toyota Innova Crysta 2.4 ZX MT BSIV,"2,05,000",Diesel,Manual,14.70,"Entally, Kolkata"
2019,Hyundai i20 Magna Plus BSIV,"51,000",Petrol,Manual,4.99,"Kasba, Kolkata"
2008,BMW X3 2.0i SAV,"54,000",Petrol,Automatic,3.65,"Kasba, Kolkata"
2015,Volkswagen Polo 1.5 TDI Comfortline,"58,000",Diesel,Manual,2.85,"Ballygunge, Kolkata"
2017,Toyota Corolla Altis VL AT,"75,000",Petrol,Automatic,6.75,"Kasba, Kolkata"
2023,Hyundai Grand i10 Nios Sportz,"9,128",Petrol,Manual,5.99,"University, Kolkata"
2019,Tata Harrier XZ BSIV,"44,000",Diesel,Manual,9.99,"Rash Behari Avenue, Kolkata"
2019,Maruti Swift LXI,"18,903",Petrol,Manual,3.84,"Kankurgachi, Kolkata"
2018,Ford Endeavour 2.2 Titanium AT 4X2,"84,779",Diesel,Automatic,22,"Vaishya Sabha, Kolkata"
2016,Maruti Swift Dzire VXI,"32,886",Petrol,Manual,4.03,"University, Kolkata"
2023,MG Hector Plus Sharp Diesel MT,"21,000",Diesel,Manual,18.99,"Park Street Area, Kolkata"
2023,MG Hector Plus 1.5 Turbo Savvy Pro CVT BSVI,"44,171",Petrol,Automatic,19,"Vaishya Sabha, Kolkata"
2017,Honda City i VTEC S,"77,000",Petrol,Manual,4.75,"Ballygunge, Kolkata"
2016,Mahindra XUV500 W10 2WD,"64,000",Diesel,Manual,6.65,"Kalighat, Kolkata"
2011,Maruti Ritz VXi,"44,407",Petrol,Manual,1.62,"Kolkatta Gpo, Kolkata"
2017,Maruti S Cross Zeta DDiS 200 SH,"57,440",Diesel,Manual,5.95,"Ballygunge, Kolkata"
2022,Tata Nexon XZ Plus BSVI,"17,000",Petrol,Manual,9.49,"Kalikapur, Kolkata"
2018,Honda City i-VTEC V,"60,000",Petrol,Manual,6.75,"Rash Behari Avenue, Kolkata"
2021,Jaguar I-Pace HSE,"63,167",Electric,Automatic,60,"Vaishya Sabha, Kolkata"
2017,Maruti Baleno RS,"25,421",Petrol,Manual,4.75,"Salt Lake City, Kolkata"
2018,Volkswagen Tiguan 2.0 TDI Highline,"80,000",Diesel,Automatic,13.75,"Kalighat, Kolkata"
2019,Hyundai i20 Sportz Plus BSIV,"48,000",Petrol,Manual,5.75,"Ballygunge, Kolkata"
2015,Honda Jazz 1.5 V i DTEC,"63,541",Diesel,Manual,3.60,"Salt Lake City, Kolkata"
2021,Hyundai i20 Sportz BSVI,"31,000",Petrol,Manual,6.65,"Bhowanipore, Kolkata"
2016,Hyundai Grand i10 Magna AT,"46,153",Petrol,Automatic,3.50,"Beleghata, Kolkata"
2014,Honda City i VTEC E,"45,000",Petrol,Manual,3.95,"Bansdroni, Kolkata"
2021,Hyundai Aura SX,"45,140",Petrol,Manual,5.95,"Salt Lake City, Kolkata"
2014,Maruti Swift VDI BSIV,"83,055",Diesel,Manual,3.06,"Kolkatta Gpo, Kolkata"
2015,Hyundai Grand i10 Sportz,"37,151",Petrol,Manual,3.35,"Beleghata, Kolkata"
2023,Skoda Slavia 1.0 TSI Ambition BSVI,"10,000",Petrol,Manual,9.38,"Kasba, Kolkata"
2016,Toyota Corolla Altis 1.8 VL CVT,"50,000",Petrol,Automatic,5.75,"Rash Behari Avenue, Kolkata"
2012,Honda City V MT,"65,000",Petrol,Manual,2.55,"Bengali Market, Kolkata"
2012,Honda Brio S MT,"76,000",Petrol,Manual,1.98,"Kasba, Kolkata"
2022,Jeep Meridian Limited Opt BSVI,"19,516",Diesel,Manual,26.50,"Vaishya Sabha, Kolkata"
2016,Hyundai Elantra 2.0 SX AT,"33,112",Petrol,Automatic,6.80,"Netaji Nagar, Kolkata"
2020,Hyundai Venue SX Opt Turbo,"12,900",Petrol,Manual,7.85,"Ballygunge, Kolkata"
2018,Volkswagen Polo 1.0 MPI Highline Plus,"25,000",Petrol,Manual,4.70,"Netaji Nagar, Kolkata"
2019,Hyundai Venue SX Turbo BSIV,"26,845",Petrol,Manual,6.57,"University, Kolkata"
2016,Hyundai Creta 1.6 VTVT S,"65,000",Petrol,Manual,5.65,"Ballygunge, Kolkata"
2012,Toyota Innova 2.5 G1 BSIV,"1,50,000",Diesel,Manual,5,"Khardah, Kolkata"
2016,BMW X1 sDrive20d Expedition,"42,000",Diesel,Automatic,13.90,"Ballygunge, Kolkata"
2018,Hyundai Elantra 2.0 SX,"52,000",Petrol,Manual,7.99,"Ballygunge, Kolkata"
2017,Renault Duster 110PS Diesel RxZ,"89,000",Diesel,Manual,6.40,"Jadavpur University, Kolkata"
2017,Honda WR-V i-VTEC VX,"45,000",Petrol,Manual,5.50,"Ballygunge, Kolkata"
2016,Toyota Innova Crysta 2.4 ZX MT BSIV,"65,000",Diesel,Manual,12.75,"Salt Lake City, Kolkata"
2013,Skoda Superb Elegance 1.8 TSI AT,"70,000",Petrol,Automatic,3.50,"Writers Building S.o, Kolkata"
2014,Maruti Wagon R VXI,"34,000",Petrol,Manual,2.85,"Jadavpur University, Kolkata"
2016,Maruti Wagon R VXI 1.2,"48,000",Petrol,Manual,2.99,"Ballygunge, Kolkata"
2010,Maruti Swift LXI,"42,981",Petrol,Manual,2.05,"Kankurgachi, Kolkata"
2016,Hyundai i20 Active 1.2,"45,000",Petrol,Manual,3.85,"Kasba, Kolkata"
2019,Hyundai i20 Sportz Plus,"48,000",Petrol,Manual,5.69,"Ballygunge, Kolkata"
2018,Hyundai Elantra 2.0 SX,"62,000",Petrol,Manual,7.90,"Ballygunge, Kolkata"
2016,Maruti S Cross DDiS 200 Alpha,"57,455",Diesel,Manual,4.97,"Salt Lake City, Kolkata"
2020,Audi A6 45 TFSI Technology BSVI,"40,868",Petrol,Automatic,35,"Vaishya Sabha, Kolkata"
2020,MG Hector Sharp Diesel MT BSIV,"56,202",Diesel,Manual,11.50,"Vaishya Sabha, Kolkata"
2014,Hyundai Verna 1.4 VTVT,"62,388",Petrol,Manual,3.70,"Salt Lake City, Kolkata"
2018,Hyundai Creta 1.6 VTVT SX Plus,"51,035",Petrol,Manual,8.90,"Salt Lake City, Kolkata"
2016,Renault Duster 85PS Diesel RxS,"45,000",Diesel,Manual,4.19,"Kolkatta GPO, Kolkata"
2014,Volkswagen Polo GT TSI,"37,100",Petrol,Automatic,4.99,"Ballygunge Rs, Kolkata"
2018,Jeep Compass 2.0 Limited Plus 4X4 BSIV,"46,000",Diesel,Manual,12.49,"Kalikapur, Kolkata"
2023,Mahindra XUV300 W8 Opt,"18,000",Petrol,Manual,9.99,"Ballygunge, Kolkata"
2022,Honda City ZX MT,"26,000",Petrol,Manual,10.25,"Parnasree Pally, Kolkata"
2014,Maruti Swift Dzire VDI,"44,128",Diesel,Manual,3.40,"Beleghata, Kolkata"
2023,Hyundai Venue S 2023-2025,"14,693",Petrol,Manual,7.71,"Vaishya Sabha, Kolkata"
2018,Audi A5 Sportback,"1,05,841",Diesel,Automatic,15,"Vaishya Sabha, Kolkata"
2019,Honda Civic ZX Diesel,"71,562",Diesel,Manual,11.79,"Airport Po, Kolkata"
2016,Audi A4 35 TDI Premium,"30,890",Diesel,Automatic,22.50,"Salt Lake City, Kolkata"
2018,Maruti Celerio X ZXI BSIV,"39,925",Petrol,Manual,3.40,"Salt Lake City, Kolkata"
2018,Hyundai Verna CRDi 1.6 SX Option,"1,09,191",Diesel,Manual,9.11,"Ballygunge, Kolkata"
2013,Maruti Zen Estilo LXI,"4,60,000",Petrol,Manual,1.94,"Bengali Market, Kolkata"
2019,Volvo XC60 D4 Momentum,"31,000",Diesel,Automatic,29,"Kasba, Kolkata"
2018,Hyundai Creta 1.6 SX Automatic,"64,490",Petrol,Automatic,8.50,"Beleghata, Kolkata"
2018,Toyota Innova Crysta 2.4 G MT 8S BSIV,"1,33,000",Diesel,Manual,12.50,"Ballygunge, Kolkata"
2018,Audi Q3 30 TFSI Premium FWD,"36,000",Petrol,Automatic,19,"Ballygunge, Kolkata"
2014,Audi A4 2.0 TDI,"46,885",Diesel,Automatic,9.70,"Alipore, Kolkata"
2015,Volkswagen Vento Magnific 1.6 Highline,"68,000",Petrol,Manual,2.99,"Kasba, Kolkata"
2018,Toyota Innova Crysta 2.4 VX MT 8S BSIV,"59,000",Diesel,Manual,16.25,"Council House Street, Kolkata"
2019,Maruti Ciaz Alpha Automatic BSIV,"22,258",Petrol,Automatic,7.63,"University, Kolkata"
2015,Volkswagen Polo GT TSI,"80,000",Petrol,Automatic,6,"Kankurgachi, Kolkata"
2015,Land Rover Range Rover Evoque 2.2L Dynamic,"45,800",Diesel,Automatic,18.75,"Ballygunge Rs, Kolkata"
2018,Toyota Corolla Altis 1.8 VL CVT,"57,000",Petrol,Automatic,9.75,"Ballygunge, Kolkata"
2020,Maruti S-Presso VXI,"25,992",Petrol,Manual,3.90,"Beleghata, Kolkata"
2015,Honda Amaze S i-Vtech,"35,000",Petrol,Manual,2.60,"Airport Po, Kolkata"
2015,Renault Duster 85PS Diesel RxL,"63,000",Diesel,Manual,3.75,"Jadavpur University, Kolkata"
2011,Chevrolet Spark 1.0 LS,"27,000",Petrol,Manual,1.10,"Ballygunge, Kolkata"
2015,Hyundai i20 Magna 1.2,"29,646",Petrol,Manual,3.78,"Kankurgachi, Kolkata"
2015,Land Rover Range Rover Evoque HSE,"45,000",Diesel,Automatic,18.75,"Kalighat, Kolkata"
2022,Honda Amaze VX i-VTEC,"12,703",Petrol,Manual,7.23,"Airport Po, Kolkata"
2010,Honda City 1.5 V MT,"55,000",Petrol,Manual,2.65,"Bansdroni, Kolkata"
2021,Hyundai Creta E BSVI,"24,000",Petrol,Manual,9.25,"Kalikapur, Kolkata"
2017,Jeep Compass 1.4 Limited,"41,000",Petrol,Automatic,8.15,"Rash Behari Avenue, Kolkata"
2024,Maruti FRONX Delta Plus AMT,"10,000",Petrol,Automatic,8,"Jadavpur University, Kolkata"
2012,Hyundai Verna 1.6 CRDi EX MT,"45,000",Diesel,Manual,2.30,"Khardah, Kolkata"
1985,Ambassador Classic 1800 Isz Mpfi,"80,000",Petrol,Manual,4.95,"Kasba, Kolkata"
2014,Audi Q3 2.0 TDI,"52,900",Diesel,Automatic,9.49,"Park Street Area, Kolkata"
2010,Hyundai Santro Xing GLS,"41,231",Petrol,Manual,1.52,"Kankurgachi, Kolkata"
2018,Hyundai Verna VTVT 1.6 SX,"37,000",Petrol,Manual,5.35,"Ballygunge, Kolkata"
2013,Renault Pulse RxL,"51,000",Diesel,Manual,1.99,"Kalighat, Kolkata"
2011,BMW 3 Series 320d,"40,000",Diesel,Automatic,7.50,"Salt Lake City, Kolkata"
2011,Maruti Alto K10 VXI,"52,368",Petrol,Manual,1.91,"Kankurgachi, Kolkata"
2018,Volvo XC40 D4 R-Design,"60,200",Diesel,Automatic,18.50,"Salt Lake City, Kolkata"
2019,Honda BR-V i-VTEC V CVT,"26,000",Petrol,Automatic,6.95,"Kasba, Kolkata"
2016,Maruti Celerio VXI AT,"74,390",Petrol,Automatic,2.95,"Khardah, Kolkata"
2016,Honda City i DTec V,"82,000",Diesel,Manual,3.65,"Kasba, Kolkata"
2024,Maruti Baleno Zeta,"1,685",Petrol,Manual,8.45,"Salt Lake City, Kolkata"
2020,Maruti Celerio ZXI AMT Optional,"52,000",Petrol,Automatic,3.85,"Ballygunge, Kolkata"
2023,MG Hector Plus 1.5 Turbo Savvy Pro CVT BSVI,"44,000",Petrol,Automatic,18.99,"Park Street Area, Kolkata"
2010,Maruti Wagon R VXI BS IV,"78,852",Petrol,Manual,1.86,"Kolkatta Gpo, Kolkata"
2022,Renault KWID 1.0 RXT BSVI,"1,939",Petrol,Manual,3.80,"University, Kolkata"
2018,Maruti Alto 800 LXi,"56,152",Petrol,Manual,2.46,"Kankurgachi, Kolkata"
2016,Honda Jazz 1.2 V i VTEC,"51,000",Petrol,Manual,3.75,"Rash Behari Avenue, Kolkata"
2021,Ford Aspire Titanium,"28,000",Petrol,Manual,4.50,"Elliot Road, Kolkata"
2016,Maruti Celerio ZXI AT Optional,"44,000",Petrol,Automatic,2.99,"Ballygunge, Kolkata"
2013,Maruti Swift Dzire VXI,"51,444",Petrol,Manual,2.60,"University, Kolkata"
2017,Nissan Micra Active XV,"23,546",Petrol,Manual,2.95,"Salt Lake City, Kolkata"
2016,Hyundai Verna 1.6 VTVT SX,"24,266",Petrol,Manual,4.33,"Kolkatta Gpo, Kolkata"
2013,Maruti Ertiga VXI,"45,683",Petrol,Manual,3.58,"Kankurgachi, Kolkata"
2022,Mahindra Scorpio N Z8L Diesel 4x4 AT,"29,100",Diesel,Automatic,21.99,"Park Street Area, Kolkata"
2019,Maruti Swift Dzire ZDI,"68,000",Diesel,Manual,6.75,"Council House Street, Kolkata"
2018,Toyota Innova Crysta 2.4 GX MT,"1,20,000",Diesel,Manual,12.51,"Ballygunge, Kolkata"
2019,Mahindra TUV 300 T4 Plus,"94,000",Diesel,Manual,5.25,"Ballygunge, Kolkata"
2013,Honda Amaze S i-Vtech,"79,000",Petrol,Manual,2.25,"Ballygunge, Kolkata"
2011,Hyundai i10 Sportz,"43,000",Petrol,Manual,2,"Jadavpur University, Kolkata"
2018,Renault KWID 1.0 AMT RXT,"54,609",Petrol,Automatic,2.89,"Kankurgachi, Kolkata"
2022,Mahindra Scorpio S5,"48,000",Diesel,Manual,12.25,"Jadavpur University, Kolkata"
2018,Toyota Yaris G BSIV,"51,093",Petrol,Manual,4.89,"Salt Lake City, Kolkata"
2023,Tata Nexon Smart Plus,"5,000",Petrol,Manual,7.50,"Ballygunge, Kolkata"
2021,Hyundai Creta E BSVI,"24,109",Petrol,Manual,9.25,"Vaishya Sabha, Kolkata"
2012,Maruti Estilo LXI,"87,931",Petrol,Manual,1.79,"Kankurgachi, Kolkata"
2019,Hyundai i20 Active SX Petrol,"84,637",Petrol,Manual,4.42,"University, Kolkata"
2016,Hyundai Creta 1.6 CRDi SX Plus,"64,000",Diesel,Manual,6.25,"Ballygunge, Kolkata"
2015,Hyundai Xcent 1.2 Kappa S,"40,000",Petrol,Manual,2.65,"Kalighat, Kolkata"
2017,Hyundai Grand i10 Sportz,"80,244",Petrol,Manual,3.30,"Salt Lake City, Kolkata"
2021,Mahindra XUV700 AX7 AT BSVI,"47,000",Petrol,Automatic,17.99,"Park Street Area, Kolkata"
2020,Hyundai Venue SX Turbo BSIV,"23,000",Petrol,Manual,7.45,"Kasba, Kolkata"
2018,Maruti Swift Dzire ZXI Plus,"72,055",Petrol,Manual,6.18,"Kolkatta GPO, Kolkata"
2021,Renault Triber RXL BSVI,"26,395",Petrol,Manual,4.75,"University, Kolkata"
2021,Hyundai Verna SX,"20,000",Petrol,Manual,9.75,"Kalikapur, Kolkata"
2012,Toyota Fortuner 4x2 Manual,"88,000",Diesel,Manual,9.50,"Salt Lake City, Kolkata"
2017,Mitsubishi Pajero Sport 4X2 AT Dual Tone,"82,541",Diesel,Automatic,14.25,"Salt Lake City, Kolkata"
2013,Tata Sumo EX BS IV,"43,085",Diesel,Manual,3.30,"Alipore, Kolkata"
2020,MG Hector Plus Sharp Pro 7 Str Diesel,"61,992",Diesel,Manual,12.80,"Airport Po, Kolkata"
2016,Toyota Corolla Altis G MT,"1,11,345",Petrol,Manual,5.25,"Salt Lake City, Kolkata"
2019,Hyundai Verna VTVT 1.4 E,"58,021",Petrol,Manual,5.30,"University, Kolkata"
2018,Lamborghini Urus V8,"27,200",Petrol,Automatic,3.39 Crore,"Ballygunge Rs, Kolkata"
2011,Maruti SX4 ZXI MT BSIV,"46,000",Petrol,Manual,1.68,"Kolkatta GPO, Kolkata"
2023,Hyundai Verna SX IVT Opt,"39,000",Petrol,Automatic,13.25,"Park Street Area, Kolkata"
2017,Nissan Micra Active XV,"21,532",Petrol,Manual,2.95,"Salt Lake City, Kolkata"
2013,Maruti Ertiga ZXI,"50,000",Petrol,Manual,4.49,"Parnasree Pally, Kolkata"
2017,Mahindra XUV500 R W10 FWD,"45,000",Diesel,Manual,8.19,"Kolkatta GPO, Kolkata"
2014,Hyundai Grand i10 Asta,"38,000",Petrol,Manual,3.10,"Netaji Nagar, Kolkata"
2017,Mercedes-Benz S-Class S 350 CDI,"34,000",Diesel,Automatic,49,"Ballygunge, Kolkata"
2011,Chevrolet Spark 1.0,"27,000",Petrol,Manual,1.10,"Ballygunge, Kolkata"
2016,Honda City i VTEC V,"38,000",Petrol,Manual,3.79,"Kalighat, Kolkata"
2023,Maruti Ertiga VXI,"7,000",Petrol,Manual,9.49,"Kalikapur, Kolkata"
2015,Honda Amaze S i-Vtech,"30,120",Petrol,Manual,3,"Entally, Kolkata"
2014,Honda Amaze S i-Vtech,"47,260",Petrol,Manual,2.40,"Alipore, Kolkata"
2015,Honda Jazz 1.2 VX i VTEC,"35,000",Petrol,Manual,2.99,"Salt Lake City, Kolkata"
2016,Tata Tiago 1.05 Revotorq XT,"47,000",Diesel,Manual,2.49,"Barisha, Kolkata"
2022,Maruti S-Presso VXI Opt 2019-2022,"1,649",Petrol,Manual,4.08,"University, Kolkata"
2022,Maruti Brezza Zxi Plus BSVI,"21,549",Petrol,Manual,9.25,"Vaishya Sabha, Kolkata"
2018,Ford Ecosport 1.5 Ti VCT MT Titanium,"65,268",Petrol,Manual,5.62,"Airport Po, Kolkata"
2018,Maruti Ertiga VXI,"21,736",Petrol,Manual,6.49,"Airport Po, Kolkata"
2018,Maruti Celerio VXI AMT BSIV,"44,000",Petrol,Automatic,3.45,"Kasba, Kolkata"
2018,Maruti Celerio X AMT VXI BSIV,"17,000",Petrol,Automatic,3.25,"Kasba, Kolkata"
2012,Toyota Etios G,"56,000",Petrol,Manual,1.95,"Bansdroni, Kolkata"
2022,Hyundai Alcazar Platinum 7-Seater AT,"24,000",Petrol,Automatic,13.90,"Ballygunge, Kolkata"
2022,Tata Nexon EV XM,"14,919",Electric,Automatic,8.98,"Kasba, Kolkata"
2022,Volkswagen Virtus Comfortline BSVI,"7,000",Petrol,Manual,8.99,"Kalikapur, Kolkata"
2020,Tata Altroz XE,"56,155",Petrol,Manual,4.15,"Alipore, Kolkata"
2014,Ford Ecosport 1.0 Ecoboost Titanium Optional,"34,000",Petrol,Manual,3.99,"Kasba, Kolkata"
2015,Toyota Fortuner 4x2 Manual,"65,000",Diesel,Manual,13.50,"Salt Lake City, Kolkata"
2011,Nissan Micra Diesel XV,"70,083",Diesel,Manual,1.35,"Alipore, Kolkata"
2014,Toyota Fortuner 4x4 MT,"65,000",Diesel,Manual,9.65,"Kasba, Kolkata"
2018,Mahindra Bolero Power Plus SLE,"1,40,965",Diesel,Manual,4.95,"Kasba, Kolkata"
2012,Hyundai i10 Sportz,"70,000",Petrol,Manual,1.65,"Ghose Bagan, Kolkata"
2017,Honda Amaze S i-VTEC,"50,706",Petrol,Manual,2.79,"Kolkatta Gpo, Kolkata"
2015,Honda Amaze S i-Vtech,"48,247",Petrol,Manual,2.30,"Baguihati Big Bazar, Kolkata"
2012,Toyota Innova 2.5 VX 7 STR BSIV,"1,55,000",Diesel,Manual,5.50,"E.k.t, Kolkata"
2014,Hyundai Grand i10 Asta,"64,000",Petrol,Manual,2.99,"Rash Behari Avenue, Kolkata"
2017,Jeep Compass 1.4 Limited,"60,000",Petrol,Automatic,7,"Kankurgachi, Kolkata"
2015,Maruti Swift VXI,"68,588",Petrol,Manual,3,"University, Kolkata"
2017,Maruti Ciaz VXi,"57,000",Petrol,Manual,3.99,"Kasba, Kolkata"
2018,Tata Tiago 1.2 Revotron XZ,"27,000",Petrol,Manual,4,"Elliot Road, Kolkata"
2017,Mitsubishi Pajero Sport 4X2 AT Dual Tone,"82,514",Diesel,Automatic,14.25,"Salt Lake City, Kolkata"
2021,BMW 5 Series 520d Luxury Line,"17,200",Diesel,Automatic,36,"Ballygunge Rs, Kolkata"
2020,Jeep Compass 2.0 Limited Plus,"45,000",Diesel,Manual,11.49,"E.k.t, Kolkata"
2013,Maruti Alto K10 LXI,"35,000",Petrol,Manual,1.95,"Barisha, Kolkata"
2011,Toyota Etios G,"63,000",Petrol,Manual,1.99,"Kasba, Kolkata"
2020,Hyundai Santro Asta,"41,142",Petrol,Manual,3.99,"Salt Lake City, Kolkata"
2014,Hyundai i20 Sportz Option 1.2,"52,000",Petrol,Manual,3.40,"Watgunge, Kolkata"
2021,Toyota Urban cruiser Mid,"20,317",Petrol,Manual,6.80,"University, Kolkata"
2023,Kia Sonet HTK Plus Turbo iMT BSVI,"23,000",Petrol,Manual,8.75,"Northern Avenue, Kolkata"
2018,Maruti Wagon R VXI Plus,"50,206",Petrol,Manual,3.25,"Salt Lake City, Kolkata"
2010,Hyundai i10 Magna 1.2,"43,971",Petrol,Manual,1.25,"Kalighat, Kolkata"
2022,Nissan Magnite XL BSVI,"15,800",Petrol,Manual,4.99,"Northern Avenue, Kolkata"
2024,Honda Elevate ZX CVT,"4,100",Petrol,Automatic,15,"Entally, Kolkata"
2020,Kia Seltos HTK Plus Diesel,"41,000",Diesel,Manual,9.90,"Ballygunge, Kolkata"
2024,Honda Amaze 2nd Gen VX,"10,000",Petrol,Manual,7.70,"Ballygunge, Kolkata"
2012,Chevrolet Beat Diesel LS,"45,900",Diesel,Manual,1.29,"Kolkatta GPO, Kolkata"
2018,Hyundai Xcent CRDi Prime T Plus,"1,21,686",Diesel,Manual,2.57,"Kolkatta Gpo, Kolkata"
2022,Kia Carens Luxury Plus Turbo DCT 6 STR 2022-2023,"10,564",Petrol,Automatic,15,"Vaishya Sabha, Kolkata"
2015,Nissan Terrano XL 110 PS,"64,200",Diesel,Manual,2.99,"Northern Avenue, Kolkata"
2014,Nissan Sunny Diesel XV,"62,000",Diesel,Manual,2.49,"Kasba, Kolkata"
2011,Chevrolet Beat LS,"47,000",Petrol,Manual,1.25,"Airport Po, Kolkata"
2022,Hyundai Grand i10 Nios Magna,"5,000",Petrol,Manual,5.75,"Ballygunge, Kolkata"
2017,Tata Tiago 1.2 Revotron XE,"35,000",Petrol,Manual,2.99,"Airport Po, Kolkata"
2015,Ford Figo 1.2 Trend Plus MT,"46,000",Petrol,Manual,2.65,"Kolkatta GPO, Kolkata"
2021,Mahindra Scorpio S11,"23,000",Diesel,Manual,14.80,"Netaji Nagar, Kolkata"
2019,Land Rover Discovery HSE 3.0 TD6,"53,546",Diesel,Automatic,32.80,"Salt Lake City, Kolkata"
2010,Fiat Linea Dynamic,"75,000",Petrol,Manual,1.50,"Ballygunge, Kolkata"
2023,Honda City ZX CVT,"11,000",Petrol,Automatic,13.95,"Ballygunge, Kolkata"
2020,Tata Altroz XE,"56,000",Petrol,Manual,4.25,"Barisha, Kolkata"
2006,Maruti Wagon R LXI BSII,"61,000",Petrol,Manual,"99,000","Ballygunge, Kolkata"
2022,Kia Carens Luxury Plus Turbo 2022-2023,"24,000",Petrol,Manual,12.30,"Entally, Kolkata"
2022,Kia Carens Luxury Plus Diesel AT BSVI,"17,510",Diesel,Automatic,15.54,"Entally, Kolkata"
2015,Volkswagen Polo 1.5 TDI Comfortline,"53,000",Diesel,Manual,2.85,"Ballygunge, Kolkata"
2016,Honda City i VTEC V,"52,000",Petrol,Manual,4.25,"Rash Behari Avenue, Kolkata"
2018,Hyundai Verna VTVT 1.6 SX Option,"39,556",Petrol,Manual,5.50,"Salt Lake City, Kolkata"
2018,Maruti Celerio ZXI Optional AMT BSIV,"40,100",Petrol,Automatic,3.84,"Entally, Kolkata"
2018,Honda WR-V i-VTEC S,"35,329",Petrol,Manual,5.10,"Salt Lake City, Kolkata"
2013,Skoda Superb Elegance 1.8 TSI AT,"21,000",Petrol,Automatic,3.99,"Kasba, Kolkata"
2021,Renault KWID 1.0 RXT Opt,"14,106",Petrol,Manual,3.70,"University, Kolkata"
2016,Mahindra Bolero SLE,"94,000",Diesel,Manual,4.35,"Kalighat, Kolkata"
2020,Maruti Baleno Delta,"41,000",Petrol,Manual,5.25,"Ballygunge, Kolkata"
2020,Maruti Baleno Delta,"48,000",Petrol,Manual,5.50,"Ballygunge, Kolkata"
2016,Renault Duster 85PS Diesel RxL,"48,000",Diesel,Manual,3.95,"Ballygunge, Kolkata"
2023,Honda City ZX CVT,"9,000",Petrol,Automatic,13.91,"Ballygunge, Kolkata"
2018,Maruti Baleno Alpha CVT,"39,881",Petrol,Automatic,5.75,"Vaishya Sabha, Kolkata"
2022,Maruti Baleno 1.2 Alpha,"23,100",Petrol,Manual,8.40,"Netaji Nagar, Kolkata"
2021,Hyundai Alcazar Platinum 7-Seater Diesel BSVI,"32,000",Diesel,Manual,13.90,"Ballygunge, Kolkata"
2020,Tata Nexon XZA Plus (O) AMT Diesel,"73,072",Diesel,Automatic,9.51,"Khardah, Kolkata"
2021,Land Rover Discovery Sport Dynamic SE Diesel,"76,550",Diesel,Automatic,43,"Vaishya Sabha, Kolkata"
2017,Maruti Ertiga SHVS ZDI Plus,"68,000",Diesel,Manual,7.65,"Council House Street, Kolkata"
2015,Hyundai Verna 1.6 VTVT SX,"41,000",Petrol,Manual,3.95,"Ballygunge, Kolkata"
2017,Ford Ecosport 1.5 Petrol Titanium,"83,258",Petrol,Manual,4.99,"Salt Lake City, Kolkata"
