Year,Car Name,Mileage (kms),Fuel Type,Transmission,Price (Lakh),Location
2020,Mercedes-Benz GLC 220d 4MATIC,"33,041",Diesel,Automatic,38,"Vaishya Sabha, Kolkata"
2010,Hyundai i20 1.2 Magna,"49,000",Petrol,Manual,1.30,"Airport Po, Kolkata"
2021,Toyota Urban cruiser Mid,"20,317",Petrol,Manual,6.80,"University, Kolkata"
2021,Renault Kiger RXL,"36,758",Petrol,Manual,4.50,"Alipore, Kolkata"
2017,Honda BR-V i-VTEC VX MT,"27,000",Petrol,Manual,6.65,"Kasba, Kolkata"
2021,Toyota Urban cruiser Mid AT,"36,990",Petrol,Automatic,7.86,"Airport Po, Kolkata"
2022,Kia Carens Prestige Plus BSVI,"10,000",Petrol,Manual,10.70,"Ballygunge, Kolkata"
2023,Land Rover Range Rover Evoque 2.0 R-Dynamic SE,"10,500",Petrol,Automatic,57.50,"Salt Lake City, Kolkata"
2015,Maruti Wagon R LXI BS IV,"77,958",Petrol,Manual,2.92,"Kolkatta Gpo, Kolkata"
2021,Maruti Alto 800 VXI BSVI,"8,462",Petrol,Manual,3.04,"University, Kolkata"
2023,Kia Sonet HTK Plus Turbo iMT BSVI,"23,000",Petrol,Manual,8.75,"Northern Avenue, Kolkata"
2023,BMW X3 2022-2025 xDrive20d M Sport,"16,400",Diesel,Automatic,56.50,"Salt Lake City, Kolkata"
2016,Maruti Vitara Brezza ZDi Plus,"1,56,480",Diesel,Manual,5.63,"Kolkatta Gpo, Kolkata"
2024,Tata Punch Adventure CNG,"7,773",CNG,Manual,7.49,"Airport Po, Kolkata"
2021,Kia Seltos HTX Diesel,"83,003",Diesel,Manual,9.50,"Alipore, Kolkata"
2022,Kia Carens Prestige Plus BSVI,"10,000",Petrol,Manual,10.70,"Ballygunge, Kolkata"
2014,Maruti Swift LXI BSIV,"1,06,807",Petrol,Manual,3.26,"Kolkatta Gpo, Kolkata"
2021,Maruti S Cross Alpha,"10,665",Petrol,Manual,7.75,"Kasba, Kolkata"
2018,Maruti Wagon R VXI Plus,"50,206",Petrol,Manual,3.25,"Salt Lake City, Kolkata"
2012,Hyundai EON Magna,"37,001",Petrol,Manual,1.75,"Garia Bt, Kolkata"
2016,Audi A4 30 TFSI Premium Plus,"60,000",Petrol,Automatic,16,Kolkata
2021,Maruti S Cross Alpha,"10,665",Petrol,Manual,7.75,"Kasba, Kolkata"
2015,Honda City i VTEC SV,"45,000",Petrol,Manual,2.85,"Baguihati Big Bazar, Kolkata"
2012,Hyundai EON Magna,"37,001",Petrol,Manual,1.75,"Garia Bt, Kolkata"
2016,Maruti Vitara Brezza ZDi Plus,"1,56,480",Diesel,Manual,5.63,"Kolkatta Gpo, Kolkata"
2024,Porsche Macan Standard,"6,900",Petrol,Automatic,79.50,"Ballygunge Rs, Kolkata"
2021,Kia Seltos HTX Diesel,"52,000",Diesel,Manual,9.80,"Barisha, Kolkata"
2011,Hyundai i10 Asta,"47,000",Petrol,Manual,1.60,"Airport Po, Kolkata"
2020,Jeep Compass 2.0 Limited Plus,"58,000",Diesel,Manual,12,Kolkata
2022,Kia Sonet HTK Plus Turbo iMT BSVI,"7,000",Petrol,Manual,8.51,"Ballygunge, Kolkata"
2015,Volkswagen Polo Exquisite 1.5 TDI Highline,"60,000",Diesel,Manual,3.25,"Watgunge, Kolkata"
2023,Kia Seltos HTX,"9,487",Petrol,Manual,13,"Vaishya Sabha, Kolkata"
2014,BMW 5 Series 520d Modern Line,"60,000",Diesel,Automatic,20,Kolkata
2020,Kia Seltos HTK Plus G,"14,000",Petrol,Manual,8.99,"Salt Lake City, Kolkata"
2022,Renault Kiger RXZ,"19,097",Petrol,Manual,5.89,"Airport Po, Kolkata"
2018,Hyundai Creta 1.6 CRDi AT SX Plus,"40,000",Diesel,Automatic,8.30,"Rash Behari Avenue, Kolkata"
2020,Ford Ecosport 1.5 Diesel Titanium Plus,"47,000",Diesel,Manual,6.20,"Kasba, Kolkata"
2023,Kia Seltos HTX,"12,750",Petrol,Manual,13.50,"Netaji Nagar, Kolkata"
2023,Kia Sonet HTK Plus Turbo iMT BSVI,"22,000",Petrol,Manual,8.95,"Ballygunge, Kolkata"
2015,Maruti Wagon R VXI BS IV,"49,000",Petrol,Manual,3,"Jadavpur University, Kolkata"
2021,Honda Jazz ZX,"38,355",Petrol,Manual,6.15,"Kolkatta Gpo, Kolkata"
2015,Maruti Baleno 1.2 Sigma,"39,000",Petrol,Manual,3.30,"Baguihati Big Bazar, Kolkata"
2021,MG Hector Sharp CVT,"48,000",Petrol,Automatic,11.90,"Ballygunge, Kolkata"
2012,Maruti Swift VXI,"19,001",Petrol,Manual,2.95,"Garia Bt, Kolkata"
2013,Mercedes-Benz B Class B180 Sports,"65,000",Petrol,Automatic,5.85,"Kasba, Kolkata"
2020,Kia Seltos HTX IVT G,"60,000",Petrol,Automatic,7.98,"Entally, Kolkata"
2022,Volkswagen Virtus Topline AT BSVI,"19,000",Petrol,Automatic,12.99,"Park Street Area, Kolkata"
2022,Honda Amaze 2nd Gen S BSVI,"13,000",Petrol,Manual,5.99,"Ballygunge, Kolkata"
2014,Maruti Swift LXI BSIV,"1,06,807",Petrol,Manual,3.26,"Kolkatta Gpo, Kolkata"
2022,Mercedes-Benz GLC 220d 4MATIC,"45,200",Diesel,Automatic,43,"Ballygunge Rs, Kolkata"
2016,Hyundai Grand i10 Sportz,"16,674",Petrol,Manual,3,"Baguihati Big Bazar, Kolkata"
2021,MG Hector Sharp DCT,"48,000",Petrol,Automatic,11.90,"Ballygunge, Kolkata"
2016,Hyundai i20 Active SX Dual Tone Petrol,"52,000",Petrol,Manual,4.25,"Kolkatta GPO, Kolkata"
2022,Kia Carens Prestige Diesel BSVI,"35,000",Diesel,Manual,10.99,"Salt Lake City, Kolkata"
2023,Mahindra XUV300 W4,"2,900",Petrol,Manual,8,"Khardah, Kolkata"
2021,Kia Seltos HTX Plus Diesel,"25,000",Diesel,Manual,10.99,"Salt Lake City, Kolkata"
2020,Honda City ZX MT,"18,000",Petrol,Manual,9.50,"Kasba, Kolkata"
2017,Maruti Vitara Brezza ZDi,"78,000",Diesel,Manual,4.95,"Ballygunge, Kolkata"
2015,Honda City i VTEC V,"44,000",Petrol,Manual,3.20,"Baguihati Big Bazar, Kolkata"
2016,Honda City i VTEC VX,"55,000",Petrol,Manual,3.80,"Baguihati Big Bazar, Kolkata"
2015,Maruti Wagon R LXI BS IV,"77,958",Petrol,Manual,2.92,"Kolkatta Gpo, Kolkata"
2021,Mahindra Bolero Neo N10 BSVI,"24,000",Diesel,Manual,7.75,"Salt Lake City, Kolkata"
2013,Hyundai i10 Sportz,"30,600",Petrol,Manual,2.35,"Narendrapur, Kolkata"
2022,Volkswagen Virtus Topline AT BSVI,"20,001",Petrol,Automatic,13,"Vaishya Sabha, Kolkata"
2022,Maruti Swift LXI BSVI,"53,241",Petrol,Manual,5.01,"Kolkatta Gpo, Kolkata"
2022,Tata Altroz XT,"2,900",Petrol,Manual,5.99,"Ballygunge, Kolkata"
2021,Kia Sonet HTX Turbo iMT BSVI,"57,523",Petrol,Manual,7.50,"Salt Lake City, Kolkata"
2022,MG Astor Savvy CVT BSVI,"28,896",Petrol,Automatic,11,"Khardah, Kolkata"
2023,BMW 2 Series 220i M Sport BSVI,"14,883",Petrol,Automatic,34,"Vaishya Sabha, Kolkata"
2022,MG Astor Sharp EX BSVI,"22,000",Petrol,Manual,10.90,"Ballygunge, Kolkata"
2022,Renault Kiger RXT Turbo,"10,080",Petrol,Manual,7.95,"Airport Po, Kolkata"
2021,Hyundai Venue SX Turbo iMT,"18,422",Petrol,Manual,7.19,"Airport Po, Kolkata"
2011,Jaguar XF Diesel,"41,000",Diesel,Automatic,8.58,"Kasba, Kolkata"
2023,Kia Carens Luxury Plus iMT,"10,000",Petrol,Manual,13.95,"Ballygunge, Kolkata"
2024,Tata Nexon Creative Plus,"6,739",Petrol,Manual,9.85,"Kasba, Kolkata"
2013,Maruti Wagon R VXI BS IV,"49,522",Petrol,Manual,2.60,"Narendrapur, Kolkata"
2013,Maruti Swift LXI,"47,392",Petrol,Manual,2.87,"Kolkatta Gpo, Kolkata"
2023,Maruti Wagon R VXI CNG,"13,633",CNG,Manual,6.08,"Kankurgachi, Kolkata"
2023,Mahindra XUV300 W8 Opt,"14,251",Petrol,Manual,9.35,"Alipore, Kolkata"
2012,Renault Duster Petrol RxL,"40,000",Petrol,Manual,2.50,"Airport Po, Kolkata"
2015,Maruti Swift Dzire LDI,"90,422",Diesel,Manual,3.50,"Kolkatta Gpo, Kolkata"
2018,Maruti Baleno 1.2 Delta,"52,000",Petrol,Manual,4.95,"Bansdroni, Kolkata"
2022,Hyundai Grand i10 Nios Corp Edition,"1,900",Petrol,Manual,5.70,"Ballygunge Rs, Kolkata"
2020,Mercedes-Benz C-Class Progressive C 220d,"23,700",Diesel,Automatic,32,"Ballygunge Rs, Kolkata"
2016,BMW 7 Series 730Ld,"20,000",Diesel,Automatic,35,"Kasba, Kolkata"
2022,Kia Sonet GTX Plus Turbo DCT,"15,853",Petrol,Automatic,9.35,"Kalighat, Kolkata"
2022,Renault Triber RXT,"22,123",Petrol,Manual,5.97,"Airport Po, Kolkata"
2024,Maruti Alto K10 VXI Plus,"2,223",Petrol,Manual,4.97,"Kankurgachi, Kolkata"
2019,Hyundai Creta 1.6 SX Option,"23,000",Petrol,Manual,8.99,"Salt Lake City, Kolkata"
2018,Hyundai EON Sportz,"27,263",Petrol,Manual,3.51,"Netaji Nagar, Kolkata"
2015,Hyundai Grand i10 Sportz,"45,000",Petrol,Manual,3.35,"Bansdroni, Kolkata"
2016,Maruti Baleno 1.3 Zeta,"55,000",Diesel,Manual,4.15,"Kalighat, Kolkata"
2019,Maruti Celerio ZXI MT BSIV,"36,000",Petrol,Manual,4.45,"Bansdroni, Kolkata"
2017,Hyundai Creta 1.6 E Plus,"53,000",Petrol,Manual,5.71,"Garia Bt, Kolkata"
2012,Ford Figo Diesel ZXI,"46,000",Diesel,Manual,1.25,"Airport Po, Kolkata"
2017,Maruti Baleno 1.2 Sigma,"2,570",Petrol,Manual,4.74,"Entally, Kolkata"
2015,Maruti Alto 800 LXI,"35,019",Petrol,Manual,2.15,"Garia Bt, Kolkata"
2021,Hyundai Venue S,"1,791",Petrol,Manual,7.80,"Airport Po, Kolkata"
2021,Maruti S-Presso VXI,"29,875",Petrol,Manual,3.97,"Kankurgachi, Kolkata"
2022,Hyundai Grand i10 Nios Magna,"6,351",Petrol,Manual,5.06,"University, Kolkata"
2017,Hyundai Creta 1.6 EX Petrol,"20,351",Petrol,Manual,6.98,"Airport Po, Kolkata"
2014,Nissan Terrano XV 110 PS,"54,000",Diesel,Manual,3.75,"Rash Behari Avenue, Kolkata"
2013,Maruti Swift Dzire VXI,"46,000",Petrol,Manual,2.85,"Airport Po, Kolkata"
2017,Mahindra KUV 100 mFALCON G80 K4,"35,000",Petrol,Manual,2.45,"Baguihati Big Bazar, Kolkata"
2020,Maruti Baleno Delta,"23,000",Petrol,Manual,5.35,"Salt Lake City, Kolkata"
2015,Hyundai Xcent 1.2 Kappa S,"93,733",Petrol,Manual,2.61,"University, Kolkata"
2016,Hyundai i20 Asta Option 1.2,"38,916",Petrol,Manual,4.17,"University, Kolkata"
2021,Renault Triber RXZ,"20,287",Petrol,Manual,5.98,"Airport Po, Kolkata"
2015,Maruti Alto 800 VXI,"73,217",Petrol,Manual,2.17,"Kolkatta Gpo, Kolkata"
2024,Mahindra Bolero B4,"14,449",Diesel,Manual,10.25,"Alipore, Kolkata"
2022,Volkswagen Taigun 1.0 TSI Comfortline BSVI,"30,043",Petrol,Manual,9.90,"Beleghata, Kolkata"
2016,Maruti Vitara Brezza ZDi Plus,"52,000",Diesel,Manual,6.25,"Bansdroni, Kolkata"
2024,Skoda Kushaq 1.5 TSI Style,"5,900",Petrol,Manual,15.95,"Ballygunge Rs, Kolkata"
2023,Maruti Dzire ZXI Plus,"19,965",Petrol,Manual,7.79,"Airport Po, Kolkata"
2014,Maruti Alto 800 LXI,"34,016",Petrol,Manual,2.15,"Garia Bt, Kolkata"
2021,Hyundai i20 Asta Opt Diesel,"35,040",Diesel,Manual,8.05,"University, Kolkata"
2015,Honda City i VTEC SV,"50,000",Petrol,Manual,3.50,"Kalighat, Kolkata"
2019,Mercedes-Benz GLA Class 200 d Sport,"15,600",Diesel,Automatic,20.95,"Salt Lake City, Kolkata"
2023,Porsche Cayenne Base,"12,500",Petrol,Automatic,1.39 Crore,"Ballygunge RS, Kolkata"
2022,Renault Triber RXT,"5,101",Petrol,Manual,6.19,"Airport Po, Kolkata"
2014,Honda Amaze S i-Vtech,"65,000",Petrol,Manual,2.85,"Ballygunge, Kolkata"
2015,Maruti Baleno Alpha Diesel,"44,963",Diesel,Manual,4.44,"Airport Po, Kolkata"
2021,Maruti S-Presso VXI 2019-2022,"32,330",Petrol,Manual,3.65,"University, Kolkata"
2017,Maruti Alto K10 VXI,"12,521",Petrol,Manual,2.80,"University, Kolkata"
2020,Tata Harrier XZ Plus BSVI,"27,601",Diesel,Manual,11.50,"Vaishya Sabha, Kolkata"
2021,Tata Altroz XZ BSVI,"12,137",Petrol,Manual,5.95,"Kasba, Kolkata"
2022,Maruti Wagon R VXI CNG,"15,900",CNG,Manual,5.78,"Kankurgachi, Kolkata"
2022,Mercedes-Benz AMG GLA 35 4MATIC BSVI,"20,500",Petrol,Automatic,44,"Salt Lake City, Kolkata"
2020,Hyundai Venue S,"27,146",Petrol,Manual,6.38,"Airport Po, Kolkata"
2020,Volkswagen Polo 1.0 MPI Trendline,"21,842",Petrol,Manual,4.50,"Beleghata, Kolkata"
2021,MG Astor Smart BSVI,"28,000",Petrol,Manual,10.90,"Ballygunge, Kolkata"
2021,Kia Sonet HTX Turbo iMT BSVI,"57,523",Petrol,Manual,7.50,"Salt Lake City, Kolkata"
2014,Maruti Swift VXI,"46,000",Petrol,Manual,3.25,"Parnasree Pally, Kolkata"
2020,Hyundai i20 Sportz BSVI,"22,000",Petrol,Manual,6.60,"Kasba, Kolkata"
2022,Maruti Swift VXI,"11,329",Petrol,Manual,5.58,"Airport Po, Kolkata"
2018,Maruti Celerio X VXI BSIV,"5,000",Petrol,Manual,4,"Jadavpur University, Kolkata"
2013,Maruti Swift VXI,"34,737",Petrol,Manual,3.05,"Kankurgachi, Kolkata"
2015,Hyundai Xcent 1.1 CRDi Base,"75,298",Diesel,Manual,2.69,"University, Kolkata"
2023,Volkswagen Virtus GT Plus DSG ES,"11,600",Petrol,Automatic,14.50,"Ballygunge Rs, Kolkata"
2022,Mahindra Bolero Neo N10 R BSVI,"62,000",Diesel,Manual,8.55,"Park Street Area, Kolkata"
2016,Mahindra XUV500 R W10 FWD,"89,999",Diesel,Manual,6,"Kankurgachi, Kolkata"
2011,Honda Jazz Basic,"49,000",Petrol,Manual,1.85,"Airport Po, Kolkata"
2020,Hyundai Venue S BSIV,"39,000",Petrol,Manual,5.95,"Kasba, Kolkata"
2022,Tata Nexon EV XZ Plus Dark Edition,"43,000",Electric,Automatic,8.98,"Kalighat, Kolkata"
2016,Hyundai Creta 1.6 CRDi SX Plus,"65,123",Diesel,Manual,6.25,"Alipore, Kolkata"
2021,Maruti S-Presso VXI,"12,229",Petrol,Manual,4.24,"Kankurgachi, Kolkata"
2022,Hyundai Venue SX Diesel BSVI,"26,000",Diesel,Manual,8.50,"Ballygunge, Kolkata"
2021,Hyundai i20 Sportz 1.2,"23,640",Petrol,Manual,6.20,"Airport Po, Kolkata"
2023,Mahindra XUV300 W8 Opt,"25,000",Petrol,Manual,8.99,"Salt Lake City, Kolkata"
2021,Hyundai i20 Magna BSVI,"11,166",Petrol,Manual,7.06,"Kolkatta GPO, Kolkata"
2016,Maruti Baleno Alpha Diesel,"89,423",Diesel,Manual,4.02,"Kankurgachi, Kolkata"
2023,Maruti Wagon R VXI,"36,000",Petrol,Manual,4.90,"Khardah, Kolkata"
2020,Tata Nexon EV XZ Plus LUX,"21,000",Electric,Automatic,9.50,"Salt Lake City, Kolkata"
2015,Maruti Baleno Alpha Diesel,"60,658",Diesel,Manual,4.16,"Airport Po, Kolkata"
2021,Renault Triber RXZ Dual Tone,"10,237",Petrol,Manual,6.68,"Airport Po, Kolkata"
2019,Honda Jazz VX,"33,000",Petrol,Manual,4.98,"Kasba, Kolkata"
2022,Hyundai Creta S Plus Knight BSVI,"25,000",Petrol,Manual,12.50,"Netaji Nagar, Kolkata"
2023,Kia Carens Luxury Plus iMT,"9,000",Petrol,Manual,14.50,"Ballygunge, Kolkata"
2022,Hyundai Creta SX BSVI,"25,373",Petrol,Manual,10.99,"University, Kolkata"
2022,Jaguar F-Pace 2.0 R-Dynamic S BSVI,"39,800",Petrol,Automatic,53.95,"Ballygunge RS, Kolkata"
2019,Kia Seltos GTX Plus,"47,000",Petrol,Manual,10.25,"Kalighat, Kolkata"
2021,Tata Tiago XZA Plus AMT BSVI,"25,361",Petrol,Automatic,5,"University, Kolkata"
2020,Kia Sonet HTX Diesel BSVI,"44,699",Diesel,Manual,7.90,"Vaishya Sabha, Kolkata"
2020,Kia Sonet HTX Diesel BSVI,"44,701",Diesel,Manual,7.89,"Kalikapur, Kolkata"
2022,Kia Sonet HTK Diesel BSVI,"16,000",Diesel,Manual,8.25,"Kasba, Kolkata"
2018,Honda WR-V i-VTEC VX,"48,792",Petrol,Manual,5.95,"Kasba, Kolkata"
2018,Maruti Vitara Brezza ZDi Plus,"56,133",Diesel,Manual,6.15,"Salt Lake City, Kolkata"
2019,Kia Seltos HTX Plus AT D,"33,000",Diesel,Automatic,11.50,"Park Street Area, Kolkata"
2019,Ford Ecosport 1.5 Diesel Trend BSIV,"55,259",Diesel,Manual,5.95,"Kasba, Kolkata"
2018,Hyundai Verna VTVT 1.6 SX Option,"27,000",Petrol,Manual,6.99,"Salt Lake City, Kolkata"
2016,Hyundai i20 Active 1.2 SX,"65,000",Petrol,Manual,3.53,"Entally, Kolkata"
2019,Tata Harrier XZ BSIV,"43,000",Diesel,Manual,10.75,"Kalighat, Kolkata"
2019,Hyundai Grand i10 1.2 Kappa Sportz BSIV,"36,959",Petrol,Manual,4.31,"Kankurgachi, Kolkata"
2014,Volkswagen Polo 1.5 TDI Comfortline,"34,000",Diesel,Manual,2.40,"Airport Po, Kolkata"
2019,Hyundai Venue S BSIV,"54,000",Petrol,Manual,6.50,"Kalighat, Kolkata"
2022,Nissan Magnite XL BSVI,"40,904",Petrol,Manual,5.05,"University, Kolkata"
2012,Hyundai i20 Sportz 1.2,"54,240",Petrol,Manual,2.29,"Kankurgachi, Kolkata"
2009,Maruti Zen Estilo 1.1 VXI BSIII,"15,874",Petrol,Manual,1.30,"Beleghata, Kolkata"
2017,Maruti Dzire ZXI,"6,988",Petrol,Manual,5.59,"Kankurgachi, Kolkata"
2024,Mahindra Bolero Neo N8,"1,500",Diesel,Manual,11.93,"Entally, Kolkata"
2019,Kia Seltos HTX Plus AT D,"32,904",Diesel,Automatic,11.50,"Vaishya Sabha, Kolkata"
2021,Hyundai Grand i10 1.2 Kappa Sportz BSIV,"15,008",Petrol,Manual,5.97,"Kankurgachi, Kolkata"
2022,Mahindra XUV700 AX7 Diesel AT Luxury Pack BSVI,"10,204",Diesel,Automatic,21,"Vaishya Sabha, Kolkata"
2014,Hyundai i20 Asta Option 1.4 CRDi,"35,000",Diesel,Manual,3.85,"Salt Lake City, Kolkata"
2018,Mahindra XUV500 AT W10 FWD,"37,000",Diesel,Automatic,9.50,"Salt Lake City, Kolkata"
2022,Jeep Compass Model S DCT BSVI,"21,000",Petrol,Automatic,16.50,"Kasba, Kolkata"
2020,Maruti Swift VXI,"53,844",Petrol,Manual,5.01,"Kankurgachi, Kolkata"
2018,Mahindra Bolero Plus AC,"52,000",Diesel,Manual,6.85,"Bansdroni, Kolkata"
2021,Hyundai i20 Sportz IVT BSVI,"47,000",Petrol,Automatic,6.49,"Kalikapur, Kolkata"
2018,Maruti Vitara Brezza VDi,"44,046",Diesel,Manual,5.78,"Airport Po, Kolkata"
2018,Honda City i-VTEC CVT VX,"42,234",Petrol,Automatic,6.69,"Kalighat, Kolkata"
2011,Chevrolet Beat LT,"43,611",Petrol,Manual,1.75,"Narendrapur, Kolkata"
2014,Ford Ecosport 1.5 Ti VCT AT Titanium,"49,500",Petrol,Automatic,3.85,"Kasba, Kolkata"
2014,Nissan Sunny XV,"31,156",Petrol,Manual,3.34,"Kankurgachi, Kolkata"
2020,Mahindra Bolero B6 Opt BSVI,"55,000",Diesel,Manual,6.95,"Bansdroni, Kolkata"
2014,Honda Amaze S i-Dtech,"36,000",Diesel,Manual,2.30,"Airport Po, Kolkata"
2020,Hyundai Venue SX Turbo,"32,202",Petrol,Manual,7.49,"Airport Po, Kolkata"
2020,Mahindra XUV300 W6 BSVI,"54,669",Petrol,Manual,6,"Vaishya Sabha, Kolkata"
2017,Tata Nexon XE Diesel,"55,537",Diesel,Manual,4.89,"Kankurgachi, Kolkata"
2020,Hyundai i20 Asta Option BSIV,"35,334",Petrol,Manual,5.70,"University, Kolkata"
2019,Hyundai Verna VTVT 1.6 SX,"68,319",Petrol,Manual,6.44,"University, Kolkata"
2016,Hyundai i20 Sportz 1.2,"36,000",Petrol,Manual,3.50,"Airport Po, Kolkata"
2021,Mahindra Bolero B6 Opt,"80,000",Diesel,Manual,6.99,"Ballygunge, Kolkata"
2017,Maruti Ertiga SHVS VDI,"65,000",Diesel,Manual,6.95,"Bansdroni, Kolkata"
2016,Maruti Baleno Alpha Diesel,"84,633",Diesel,Manual,4.39,"Kankurgachi, Kolkata"
2017,Hyundai Creta 1.4 CRDi S Plus,"43,000",Diesel,Manual,5.75,"Kalighat, Kolkata"
2023,Hyundai Creta SX Opt Turbo DCT,"9,893",Petrol,Automatic,14.93,"Airport Po, Kolkata"
2022,Hyundai Venue SX Plus Turbo DCT,"26,897",Petrol,Automatic,8.98,"Airport Po, Kolkata"
2019,Maruti Ciaz Delta,"23,000",Petrol,Manual,6.50,"Jadavpur University, Kolkata"
2017,Datsun RediGO 1.0 T Option,"35,000",Petrol,Manual,1.99,"Airport Po, Kolkata"
2021,Maruti Alto 800 VXI,"4,047",Petrol,Manual,3.29,"Kankurgachi, Kolkata"
2019,Mahindra XUV500 W3 BSIV,"31,132",Diesel,Manual,8,"Netaji Nagar, Kolkata"
2022,Hyundai Venue SX DT Diesel,"25,000",Diesel,Manual,8.90,"Ballygunge, Kolkata"
2013,Maruti Ritz LDi,"1,00,500",Diesel,Manual,1.99,"Kasba, Kolkata"
2019,Hyundai Grand i10 Nios AMT Sportz,"50,000",Petrol,Automatic,5,"Watgunge, Kolkata"
2014,Hyundai Grand i10 Asta,"57,000",Petrol,Manual,3.25,"Bansdroni, Kolkata"
2020,Hyundai Creta SX Opt Turbo BSVI,"34,274",Petrol,Automatic,10.49,"Kalighat, Kolkata"
2021,Maruti S-Presso VXI Plus 2019-2022,"37,445",Petrol,Manual,3.70,"University, Kolkata"
2019,Renault KWID 1.0 RXT Opt,"14,639",Petrol,Manual,3.21,"Kankurgachi, Kolkata"
2019,Kia Seltos GTX Plus,"39,000",Petrol,Manual,11,"Ballygunge, Kolkata"
2013,Maruti Wagon R VXI BS IV,"38,000",Petrol,Manual,2.60,"Jadavpur University, Kolkata"
2019,Renault Duster RXS BSIV,"26,018",Petrol,Manual,4.89,"University, Kolkata"
2019,Kia Seltos GTX Plus,"47,000",Petrol,Manual,10.35,"Rash Behari Avenue, Kolkata"
2020,Kia Seltos HTX G,"19,000",Petrol,Manual,9.25,"Ballygunge, Kolkata"
2016,Maruti Baleno 1.2 CVT Delta,"60,141",Petrol,Automatic,4.25,"Salt Lake City, Kolkata"
2015,Hyundai i20 Asta 1.2,"48,000",Petrol,Manual,3.99,"Bansdroni, Kolkata"
2018,Hyundai Creta 1.6 VTVT AT SX Plus,"38,430",Petrol,Automatic,8.50,"Vaishya Sabha, Kolkata"
2015,Hyundai Verna 1.6 SX VTVT,"28,000",Petrol,Manual,3.90,"Kasba, Kolkata"
2021,Hyundai Santro Magna Corp Edition,"17,062",Petrol,Manual,3.96,"Kankurgachi, Kolkata"
2022,Mahindra Scorpio S5,"52,000",Diesel,Manual,11.65,"Bansdroni, Kolkata"
2014,Mahindra XUV500 W8 2WD,"41,000",Diesel,Manual,5.50,"Salt Lake City, Kolkata"
2021,Kia Carnival Prestige,"14,600",Diesel,Automatic,23.75,"Ballygunge Rs, Kolkata"
2019,Mercedes-Benz GLE 43 AMG Coupe,"28,500",Petrol,Automatic,56.50,"Ballygunge Rs, Kolkata"
2019,Jeep Compass 2.0 Limited Plus BSIV,"25,000",Diesel,Manual,12.50,"Salt Lake City, Kolkata"
2020,Tata Nexon 1.5 Revotorq XM,"35,000",Diesel,Manual,6.99,"Jadavpur University, Kolkata"
2015,Maruti Alto 800 LXi,"34,911",Petrol,Manual,2.31,"Kankurgachi, Kolkata"
2018,Maruti Baleno 1.2 CVT Alpha,"42,000",Petrol,Automatic,5.49,"Park Street Area, Kolkata"
2017,Hyundai i20 1.2 Magna Executive,"64,000",Petrol,Manual,3.50,"Ballygunge, Kolkata"
2013,Honda Amaze SX i-VTEC,"58,000",Petrol,Manual,2.55,"Ballygunge, Kolkata"
2019,Toyota Glanza V CVT,"30,245",Petrol,Automatic,5.99,"Alipore, Kolkata"
2019,Kia Seltos GTX Plus,"60,000",Petrol,Manual,10.99,"Watgunge, Kolkata"
2020,MG Gloster Savvy 6-Str,"31,999",Diesel,Automatic,26,"Vaishya Sabha, Kolkata"
2020,Maruti Baleno Zeta Diesel,"20,012",Diesel,Manual,6.29,"Airport Po, Kolkata"
2022,Mahindra XUV700 AX7L 7Str Diesel AT,"10,200",Diesel,Automatic,20.99,"Park Street Area, Kolkata"
2017,Maruti Alto 800 LXi,"27,760",Petrol,Manual,2.33,"Kankurgachi, Kolkata"
2021,Hyundai i20 Magna BSVI,"33,521",Petrol,Manual,5.59,"University, Kolkata"
2020,Renault KWID Climber 1.0 MT Opt,"13,107",Petrol,Manual,4.06,"Kankurgachi, Kolkata"
2023,Volkswagen Taigun 1.5 TSI GT Plus BSVI,"36,900",Petrol,Manual,10.99,"Park Street Area, Kolkata"
2021,Kia Seltos GTX Plus Diesel AT,"52,275",Diesel,Automatic,13,"Vaishya Sabha, Kolkata"
2020,Hyundai Creta SX BSVI,"21,619",Petrol,Manual,9.80,"University, Kolkata"
2016,Maruti Swift VXI,"51,000",Petrol,Manual,3.35,"Parnasree Pally, Kolkata"
2023,Toyota Hyryder G HYBRID BSVI,"12,000",Petrol,Automatic,14.95,"Ballygunge, Kolkata"
2020,Maruti Wagon R VXI 1.2,"45,000",Petrol,Manual,4.45,"Bansdroni, Kolkata"
2023,Tata Tiago XT,"14,000",Petrol,Manual,6.99,"Entally, Kolkata"
2018,Toyota Innova Crysta 2.4 G MT 8S BSIV,"64,000",Diesel,Manual,14.95,"Kasba, Kolkata"
2018,Mercedes-Benz S-Class S 350 d,"19,600",Diesel,Automatic,57.50,"Ballygunge Rs, Kolkata"
2019,Kia Seltos GTX Plus,"46,000",Petrol,Manual,9.95,"Ballygunge, Kolkata"
2022,Skoda Slavia 1.5 TSI Ambition,"15,180",Petrol,Manual,10.44,"Airport Po, Kolkata"
2024,Honda Amaze 2nd Gen VX BSVI,"9,000",Petrol,Manual,7.95,"Ballygunge, Kolkata"
2020,Renault KWID Climber 1.0 MT Opt,"24,541",Petrol,Manual,3.78,"Kankurgachi, Kolkata"
2019,Honda WR-V i-VTEC S,"36,080",Petrol,Manual,5.50,"Beleghata, Kolkata"
2012,Maruti Swift VDI,"35,000",Diesel,Manual,2.50,"Salt Lake City, Kolkata"
2016,Maruti Alto 800 VXI,"49,055",Petrol,Manual,2.45,"Kankurgachi, Kolkata"
2021,Renault KWID Climber 1.0 MT Opt,"17,844",Petrol,Manual,4.15,"Kankurgachi, Kolkata"
2020,Hyundai Venue SX Turbo iMT,"41,688",Petrol,Manual,6.80,"Kasba, Kolkata"
2017,Maruti Vitara Brezza VDi Option,"70,625",Diesel,Manual,5.46,"Kolkatta Gpo, Kolkata"
2020,Maruti Swift VXI,"40,592",Petrol,Manual,4.75,"Vaishya Sabha, Kolkata"
2021,Tata Tiago XZ 2020-2022,"16,983",Petrol,Manual,4.95,"University, Kolkata"
2022,Tata Tigor XZ Plus BSVI,"3,228",Petrol,Manual,5.64,"University, Kolkata"
2020,Honda Jazz VX CVT,"25,000",Petrol,Automatic,5.79,"Northern Avenue, Kolkata"
2023,Kia Seltos X-Line Turbo DCT,"12,867",Petrol,Automatic,18,"Vaishya Sabha, Kolkata"
2018,Honda City i-DTEC ZX,"46,235",Diesel,Manual,7.50,"Beleghata, Kolkata"
2011,Volkswagen Polo Petrol Highline 1.2L,"72,925",Petrol,Manual,5,"Vaishya Sabha, Kolkata"
2019,Maruti Alto 800 LXi,"23,656",Petrol,Manual,2.95,"Kankurgachi, Kolkata"
2019,Hyundai Creta 1.6 SX Automatic,"31,500",Petrol,Automatic,8.95,"Northern Avenue, Kolkata"
2018,Hyundai Verna VTVT 1.6 SX,"37,000",Petrol,Manual,5.35,"Ballygunge, Kolkata"
2015,Hyundai Verna 1.6 SX VTVT,"41,000",Petrol,Manual,3.75,"Ballygunge, Kolkata"
2016,Mahindra KUV 100 mFALCON D75 K8,"58,000",Diesel,Manual,2.45,"Baguihati Big Bazar, Kolkata"
2019,Mercedes-Benz GLA Class 200 d Sport,"32,569",Diesel,Automatic,20,"Vaishya Sabha, Kolkata"
2014,Hyundai Grand i10 Sportz,"34,000",Petrol,Manual,2.99,"Airport Po, Kolkata"
2020,Maruti Swift VXI,"46,000",Petrol,Manual,4.75,"Kalikapur, Kolkata"
2021,Skoda Kushaq 1.5 TSI Style BSVI,"34,000",Petrol,Manual,10.90,"Ballygunge, Kolkata"
2018,Hyundai Creta 1.6 E Plus,"48,000",Petrol,Manual,5.49,"Barisha, Kolkata"
2015,Maruti Wagon R LXI,"27,416",Petrol,Manual,2.58,"Kankurgachi, Kolkata"
2023,Volkswagen Taigun 1.5 TSI GT Plus BSVI,"36,872",Petrol,Manual,11,"Vaishya Sabha, Kolkata"
2015,Mahindra TUV 300 T6 Plus,"34,020",Diesel,Manual,5.15,"Garia Bt, Kolkata"
2019,Hyundai i20 Sportz Plus BSIV,"45,934",Petrol,Manual,5.25,"Kalikapur, Kolkata"
2010,Maruti Alto 800 LXi,"62,572",Petrol,Manual,1.10,"Narendrapur, Kolkata"
2014,Maruti Wagon R VXI,"34,000",Petrol,Manual,2.80,"Jadavpur University, Kolkata"
2018,Maruti Swift Dzire VDI,"65,000",Diesel,Manual,5.75,"Bansdroni, Kolkata"
2022,Hyundai Verna SX,"3,326",Petrol,Manual,9.75,"Salt Lake City, Kolkata"
2022,Honda Jazz ZX,"21,265",Petrol,Manual,7.05,"Airport Po, Kolkata"
2015,Maruti Swift VXI,"75,229",Petrol,Manual,3.18,"University, Kolkata"
2016,Toyota Corolla Altis 1.8 VL CVT,"46,700",Petrol,Automatic,7.25,"Park Street Area, Kolkata"
2013,Volkswagen CrossPolo 1.5 TDI,"43,000",Diesel,Manual,2.99,"Rash Behari Avenue, Kolkata"
2015,Renault Duster Petrol RxE,"36,853",Petrol,Manual,3.15,"Kankurgachi, Kolkata"
2021,Skoda Kushaq 1.5 TSI Style BSVI,"33,000",Petrol,Manual,10.90,"Ballygunge, Kolkata"
2016,Maruti Baleno 1.2 CVT Delta,"60,141",Petrol,Automatic,4.25,"Salt Lake City, Kolkata"
2016,Hyundai Creta 1.4 CRDi S Plus,"45,000",Diesel,Manual,5.75,"Council House Street, Kolkata"
2019,Maruti Ciaz Delta,"30,307",Petrol,Manual,6.25,"Kasba, Kolkata"
2022,Hyundai Verna SX,"3,326",Petrol,Manual,9.75,"Salt Lake City, Kolkata"
2019,Hyundai i20 Asta Option CVT BSIV,"57,000",Petrol,Automatic,5.50,"Ballygunge, Kolkata"
2012,Toyota Fortuner 4x4 MT,"55,000",Diesel,Manual,9,"Salt Lake City, Kolkata"
2014,Honda Amaze S i-Dtech,"61,000",Diesel,Manual,2.50,"Asylum Lane, Kolkata"
2020,Maruti Wagon R ZXI 1.2,"40,114",Petrol,Manual,4.50,"Beleghata, Kolkata"
2016,Hyundai Creta 1.6 CRDi SX Plus Dual Tone,"59,000",Diesel,Manual,6.25,"Ballygunge, Kolkata"
2020,Tata Nexon XZ Plus Diesel S,"26,944",Diesel,Manual,8.50,"University, Kolkata"
2021,Ford Ecosport 1.5 TDCi Titanium BSIV,"46,644",Diesel,Manual,6.98,"Airport Po, Kolkata"
2018,Toyota Yaris G Optional CVT,"57,000",Petrol,Automatic,5.75,"Ballygunge, Kolkata"
2016,Hyundai Creta 1.6 VTVT S,"57,000",Petrol,Manual,5.65,"Ballygunge, Kolkata"
2021,Tata Altroz XE,"10,735",Petrol,Manual,5.19,"Kankurgachi, Kolkata"
2022,Tata Nexon XZ Plus Kaziranga Edition,"22,945",Petrol,Manual,8.50,"University, Kolkata"
2019,Hyundai Grand i10 1.2 Kappa Asta,"17,620",Petrol,Manual,4.94,"Kankurgachi, Kolkata"
